{
  "schemaVersion": 1,
  "groupId": "artists",
  "labelKey": "filters.groups.artists",
  "descriptionKey": "filters.groups.artists.description",
  "filters": [
    { "id": "mondriaan", "labelKey": "filters.artists.mondriaan", "performance": "veryStrong", "controls": [{ "id": "strength", "stateKey": "mondriaan", "labelKey": "filters.artists.mondriaan", "type": "range", "min": 0, "max": 1000, "step": 1, "defaultValue": 0 }] },
    { "id": "van-gogh", "labelKey": "filters.artists.vanGogh", "performance": "veryStrong", "controls": [{ "id": "strength", "stateKey": "vanGogh", "labelKey": "filters.artists.vanGogh", "type": "range", "min": 0, "max": 1000, "step": 1, "defaultValue": 0 }] },
    { "id": "august-macke", "labelKey": "filters.artists.augustMacke", "performance": "veryStrong", "controls": [{ "id": "strength", "stateKey": "augustMacke", "labelKey": "filters.artists.augustMacke", "type": "range", "min": 0, "max": 1000, "step": 1, "defaultValue": 0 }] },
    { "id": "arp", "labelKey": "filters.artists.arp", "performance": "veryStrong", "controls": [{ "id": "strength", "stateKey": "arp", "labelKey": "filters.artists.arp", "type": "range", "min": 0, "max": 1000, "step": 1, "defaultValue": 0 }] },
    { "id": "paul-klee", "labelKey": "filters.artists.paulKlee", "performance": "veryStrong", "controls": [{ "id": "strength", "stateKey": "paulKlee", "labelKey": "filters.artists.paulKlee", "type": "range", "min": 0, "max": 1000, "step": 1, "defaultValue": 0 }] },
    { "id": "marc-chagall", "labelKey": "filters.artists.marcChagall", "performance": "veryStrong", "controls": [{ "id": "strength", "stateKey": "marcChagall", "labelKey": "filters.artists.marcChagall", "type": "range", "min": 0, "max": 1000, "step": 1, "defaultValue": 0 }] },
    { "id": "kandinsky", "labelKey": "filters.artists.kandinsky", "performance": "veryStrong", "controls": [{ "id": "strength", "stateKey": "kandinsky", "labelKey": "filters.artists.kandinsky", "type": "range", "min": 0, "max": 1000, "step": 1, "defaultValue": 0 }] },
    { "id": "malevich", "labelKey": "filters.artists.malevich", "performance": "veryStrong", "controls": [{ "id": "strength", "stateKey": "malevich", "labelKey": "filters.artists.malevich", "type": "range", "min": 0, "max": 1000, "step": 1, "defaultValue": 0 }] },
    { "id": "sonia-delaunay", "labelKey": "filters.artists.soniaDelaunay", "performance": "veryStrong", "controls": [{ "id": "strength", "stateKey": "soniaDelaunay", "labelKey": "filters.artists.soniaDelaunay", "type": "range", "min": 0, "max": 1000, "step": 1, "defaultValue": 0 }] },
    { "id": "robert-delaunay", "labelKey": "filters.artists.robertDelaunay", "performance": "veryStrong", "controls": [{ "id": "strength", "stateKey": "robertDelaunay", "labelKey": "filters.artists.robertDelaunay", "type": "range", "min": 0, "max": 1000, "step": 1, "defaultValue": 0 }] },
    { "id": "cezanne", "labelKey": "filters.artists.cezanne", "performance": "veryStrong", "controls": [{ "id": "strength", "stateKey": "cezanne", "labelKey": "filters.artists.cezanne", "type": "range", "min": 0, "max": 1000, "step": 1, "defaultValue": 0 }] },
    { "id": "braque", "labelKey": "filters.artists.braque", "performance": "veryStrong", "controls": [{ "id": "strength", "stateKey": "braque", "labelKey": "filters.artists.braque", "type": "range", "min": 0, "max": 1000, "step": 1, "defaultValue": 0 }] },
    { "id": "franz-marc", "labelKey": "filters.artists.franzMarc", "performance": "veryStrong", "controls": [{ "id": "strength", "stateKey": "franzMarc", "labelKey": "filters.artists.franzMarc", "type": "range", "min": 0, "max": 1000, "step": 1, "defaultValue": 0 }] },
    { "id": "schiele", "labelKey": "filters.artists.schiele", "performance": "veryStrong", "controls": [{ "id": "strength", "stateKey": "schiele", "labelKey": "filters.artists.schiele", "type": "range", "min": 0, "max": 1000, "step": 1, "defaultValue": 0 }] },
    { "id": "matisse", "labelKey": "filters.artists.matisse", "performance": "veryStrong", "controls": [{ "id": "strength", "stateKey": "matisse", "labelKey": "filters.artists.matisse", "type": "range", "min": 0, "max": 1000, "step": 1, "defaultValue": 0 }] },
    { "id": "miro", "labelKey": "filters.artists.miro", "performance": "veryStrong", "controls": [{ "id": "strength", "stateKey": "miro", "labelKey": "filters.artists.miro", "type": "range", "min": 0, "max": 1000, "step": 1, "defaultValue": 0 }] },
    { "id": "pollock", "labelKey": "filters.artists.pollock", "performance": "veryStrong", "controls": [{ "id": "strength", "stateKey": "pollock", "labelKey": "filters.artists.pollock", "type": "range", "min": 0, "max": 1000, "step": 1, "defaultValue": 0 }] },
    { "id": "lichtenstein", "labelKey": "filters.artists.lichtenstein", "performance": "veryStrong", "controls": [{ "id": "strength", "stateKey": "lichtenstein", "labelKey": "filters.artists.lichtenstein", "type": "range", "min": 0, "max": 1000, "step": 1, "defaultValue": 0 }] },
    { "id": "hokusai", "labelKey": "filters.artists.hokusai", "performance": "veryStrong", "controls": [{ "id": "strength", "stateKey": "hokusai", "labelKey": "filters.artists.hokusai", "type": "range", "min": 0, "max": 1000, "step": 1, "defaultValue": 0 }] },
    { "id": "escher", "labelKey": "filters.artists.escher", "performance": "veryStrong", "controls": [{ "id": "strength", "stateKey": "escher", "labelKey": "filters.artists.escher", "type": "range", "min": 0, "max": 1000, "step": 1, "defaultValue": 0 }] },
    { "id": "klimt", "labelKey": "filters.artists.klimt", "performance": "veryStrong", "controls": [{ "id": "strength", "stateKey": "klimt", "labelKey": "filters.artists.klimt", "type": "range", "min": 0, "max": 1000, "step": 1, "defaultValue": 0 }] },
    { "id": "hilma-af-klint", "labelKey": "filters.artists.hilmaAfKlint", "performance": "veryStrong", "controls": [{ "id": "strength", "stateKey": "hilmaAfKlint", "labelKey": "filters.artists.hilmaAfKlint", "type": "range", "min": 0, "max": 1000, "step": 1, "defaultValue": 0 }] },
    { "id": "kusama", "labelKey": "filters.artists.kusama", "performance": "veryStrong", "controls": [{ "id": "strength", "stateKey": "kusama", "labelKey": "filters.artists.kusama", "type": "range", "min": 0, "max": 1000, "step": 1, "defaultValue": 0 }] },
    { "id": "gerhard-richter", "labelKey": "filters.artists.gerhardRichter", "performance": "veryStrong", "controls": [{ "id": "strength", "stateKey": "gerhardRichter", "labelKey": "filters.artists.gerhardRichter", "type": "range", "min": 0, "max": 1000, "step": 1, "defaultValue": 0 }] },
    { "id": "monet", "labelKey": "filters.artists.monet", "performance": "veryStrong", "controls": [{ "id": "strength", "stateKey": "monet", "labelKey": "filters.artists.monet", "type": "range", "min": 0, "max": 1000, "step": 1, "defaultValue": 0 }] },
    { "id": "picasso", "labelKey": "filters.artists.picasso", "performance": "veryStrong", "controls": [{ "id": "strength", "stateKey": "picasso", "labelKey": "filters.artists.picasso", "type": "range", "min": 0, "max": 1000, "step": 1, "defaultValue": 0 }] },
    { "id": "otto-dix", "labelKey": "filters.artists.ottoDix", "performance": "veryStrong", "controls": [{ "id": "strength", "stateKey": "ottoDix", "labelKey": "filters.artists.ottoDix", "type": "range", "min": 0, "max": 1000, "step": 1, "defaultValue": 0 }] },
    { "id": "andy-warhol", "labelKey": "filters.artists.andyWarhol", "performance": "veryStrong", "controls": [{ "id": "strength", "stateKey": "andyWarhol", "labelKey": "filters.artists.andyWarhol", "type": "range", "min": 0, "max": 1000, "step": 1, "defaultValue": 0 }] },
    { "id": "botticelli", "labelKey": "filters.artists.botticelli", "performance": "veryStrong", "controls": [{ "id": "strength", "stateKey": "botticelli", "labelKey": "filters.artists.botticelli", "type": "range", "min": 0, "max": 1000, "step": 1, "defaultValue": 0 }] },
    { "id": "munch", "labelKey": "filters.artists.munch", "performance": "veryStrong", "controls": [{ "id": "strength", "stateKey": "munch", "labelKey": "filters.artists.munch", "type": "range", "min": 0, "max": 1000, "step": 1, "defaultValue": 0 }] },
    { "id": "toulouse-lautrec", "labelKey": "filters.artists.toulouseLautrec", "performance": "veryStrong", "controls": [{ "id": "strength", "stateKey": "toulouseLautrec", "labelKey": "filters.artists.toulouseLautrec", "type": "range", "min": 0, "max": 1000, "step": 1, "defaultValue": 0 }] },
    { "id": "salvador-dali", "labelKey": "filters.artists.salvadorDali", "performance": "veryStrong", "controls": [{ "id": "strength", "stateKey": "salvadorDali", "labelKey": "filters.artists.salvadorDali", "type": "range", "min": 0, "max": 1000, "step": 1, "defaultValue": 0 }] }
  ]
}
